[
  {
    "id": "dates-unknown",
    "type": "period",
    "name": "Dates Unknown",
    "startYear": 4000,
    "endYear": 2500,
    "certainty": "approximate",
    "categories": [
      "period"
    ],
    "color": "#E0E0E0",
    "description": "Creation, Fall, Flood, Tower of Babel"
  },
  {
    "id": "patriarchs",
    "type": "period",
    "name": "Time of the Patriarchs",
    "startYear": 2166,
    "endYear": 1876,
    "certainty": "approximate",
    "categories": [
      "period"
    ],
    "color": "#FFF9C4",
    "description": "Abraham, Isaac, Jacob"
  },
  {
    "id": "egypt",
    "type": "period",
    "name": "Israel in Egypt",
    "startYear": 1876,
    "endYear": 1446,
    "certainty": "approximate",
    "categories": [
      "period"
    ],
    "color": "#FFCCBC",
    "description": "Israel enslaved in Egypt"
  },
  {
    "id": "wandering",
    "type": "period",
    "name": "Wandering",
    "startYear": 1446,
    "endYear": 1406,
    "certainty": "approximate",
    "categories": [
      "period"
    ],
    "color": "#D7CCC8",
    "description": "Wilderness journey to Promised Land"
  },
  {
    "id": "judges",
    "type": "period",
    "name": "Era of the Judges",
    "startYear": 1406,
    "endYear": 1050,
    "certainty": "approximate",
    "categories": [
      "period"
    ],
    "color": "#C8E6C9",
    "description": "Israel repeatedly fell into idolatry, oppression, repentance, and deliverance through judges (military leaders/prophets). This cycle lasted about 350 years."
  },
  {
    "id": "united-kingdom",
    "type": "period",
    "name": "The Kings / United Kingdom",
    "startYear": 1050,
    "endYear": 930,
    "certainty": "approximate",
    "categories": [
      "period"
    ],
    "color": "#BBDEFB",
    "description": "Saul, David, Solomon united Israel"
  },
  {
    "id": "divided-kingdom",
    "type": "period",
    "name": "Kingdom Divides",
    "startYear": 930,
    "endYear": 586,
    "certainty": "approximate",
    "categories": [
      "period"
    ],
    "color": "#E1BEE7",
    "description": "The kingdom split into Israel (north, 10 tribes) and Judah (south, 2 tribes). Ended with the fall of both kingdoms."
  },
  {
    "id": "exile",
    "type": "period",
    "name": "Exile",
    "startYear": 586,
    "endYear": 538,
    "certainty": "approximate",
    "categories": [
      "period"
    ],
    "color": "#BDBDBD",
    "description": "Babylonian captivity"
  },
  {
    "id": "restoration",
    "type": "period",
    "name": "The Restoration",
    "startYear": 538,
    "endYear": 400,
    "certainty": "approximate",
    "categories": [
      "period"
    ],
    "color": "#B2DFDB",
    "description": "Return from exile, temple rebuilt"
  }
]